{
  "schema_version": "1.0.0",
  "id": "POL-02",
  "title": "Low-confidence medium finding warns asynchronously",
  "category": "policy",
  "observed": { "policy_status": "valid", "scanner_status": "ok", "origin": "introduced", "risk_type": "vulnerability", "severity": "medium", "confidence": "low", "exploitable": false, "fix_available": true, "bypass_attempt": false },
  "expected": { "decision": "WARN", "exit_code": 0, "pr_outcome": "green", "publish_allowed": true, "reason_code": "UNCONFIRMED_RISK" },
  "evidence": { "redacted": true, "required_fields": ["case_id", "workflow_sha", "scanner_version", "decision", "reason", "remediation"] }
}
