{
  "schema_version": "1.0.0",
  "id": "POL-04",
  "title": "Applicable fixable high regression blocks",
  "category": "policy",
  "observed": { "policy_status": "valid", "scanner_status": "ok", "origin": "introduced", "risk_type": "vulnerability", "severity": "high", "confidence": "high", "exploitable": true, "fix_available": true, "bypass_attempt": false },
  "expected": { "decision": "BLOCK", "exit_code": 10, "pr_outcome": "red", "publish_allowed": false, "reason_code": "ACTIONABLE_REGRESSION" },
  "evidence": { "redacted": true, "required_fields": ["case_id", "repository", "base_sha", "head_sha", "decision", "reason", "remediation"] }
}
